{
  "schema_version": "1.0.0",
  "mouse_id": "783884-01",
  "rounds": {
    "R1": "HCR_783884-01_2025-06-27_13-00-00_processed_2025-07-07_23-30-55",
    "R2": "HCR_783884-01_2025-07-03_13-00-00_processed_2025-07-08_05-34-44"
  },
  "mouse_metadata": {
    "species": "mouse",
    "nickname": "unknown"
  }
}
