{
  "schema_version": "1.0.0",
  "mouse_id": "800995-old",
  "rounds": {
    "R1": "HCR_800995_2026-03-12_13-00-00_processed_2026-03-17_22-34-07",
    "R2": "HCR_800995_2026-03-18_13-00-00_processed_2026-03-23_18-43-25",
    "R3": "HCR_800995_2026-03-25_14-00-00_processed_2026-03-30_21-01-05",
    "R4": "HCR_800995_2026-04-01_13-00-00_processed_2026-04-06_22-56-16",
    "R5": "HCR_800995_2026-04-08_13-00-00_processed_2026-04-13_21-37-30",
    "R6": "HCR_800995_2026-04-15_13-00-00_processed_2026-04-22_00-14-21"
  },
  "mouse_metadata": {
    "species": "mouse",
    "nickname": "Dandilion"
  },
  "derived_assets": {
    "roi_shape_metrics": "HCR_800995_roi-shape-metrics_2026-06-25_21-31-41",
    "pairwise_unmixing": "HCR_800995_pairwise-unmixing_2026-06-29_17-49-24",
    "coreg_id_mapping": "multiplane-ophys_800995_2025-08-05_13-25-58_processed_2025-08-06_13-03-12_CTL-coreg-id-mapping_2026-07-08_21-24-20",
    "roi_classifier_3d": "HCR_800995_2026-03-12_13-00-00_HCR-ROI-label_2026-06-30_20-30-12"
  },
  "notes": [
    "Previous processing epoch: rounds processed 2026-03/2026-04. Superseded by the July 2026 reprocessing recorded under mouse_id 800995; kept because the derived assets listed here were computed from these rounds."
  ]
}
