{
  "schema_version": "1.0.0",
  "mouse_id": "754803",
  "rounds": {
    "R1": "HCR_754803_2025-08-20_14-00-00_processed_2025-09-10_00-33-24",
    "R2": "HCR_754803_2025-08-28_13-00-00_processed_2025-09-10_00-34-18",
    "R3": "HCR_754803_2025-09-05_13-00-00_processed_2025-09-10_00-34-51",
    "R4": "HCR_754803_2025-09-11_13-00-00_processed_2025-09-13_20-42-41",
    "R5": "HCR_754803_2025-09-18_13-00-00_processed_2025-09-20_22-57-09"
  },
  "mouse_metadata": {
    "species": "mouse",
    "nickname": "Old bay"
  }
}
