{
  "schema_version": "1.0.0",
  "mouse_id": "782149",
  "rounds": {
    "R1": "HCR_782149_2025-11-05_13-00-00_processed_2025-11-10_20-37-29",
    "R2": "HCR_782149_2025-11-12_13-00-00_processed_2025-11-13_22-04-32",
    "R3": "HCR_782149_2025-11-19_13-00-00_processed_2025-11-21_01-27-24",
    "R4": "HCR_782149_2025-12-04_13-00-00_processed_2025-12-05_22-31-35",
    "R5": "HCR_782149_2025-12-11_13-00-00_processed_2025-12-12_23-45-26"
  },
  "mouse_metadata": {
    "species": "mouse",
    "nickname": "Lemongrass"
  },
  "derived_assets": {
    "roi_shape_metrics": "HCR_782149_2025-11-05_13-00-00_roi-shape-metrics",
    "cell_typing": "HCR_782149_cell-typing_2026-03-08_12-00-00",
    "pairwise_unmixing": "HCR_782149_pairwise-unmixing_2026-07-14_18-11-49",
    "czstack_hcr_coreg": "782149_2025-05-01_ctl-czstack-hcr-coreg_2026-03-03_00-00-00",
    "coreg_id_mapping": "multiplane-ophys_782149_2025-03-28_10-55-25_processed_2025-09-11_20-46-54_CTL-coreg-id-mapping_2026-07-08_21-21-09",
    "roi_classifier_3d": "HCR_782149_2025-11-05_13-00-00_HCR-ROI-label_2026-06-30_20-17-18"
  },
  "notes": [
    "Tissue thickness is smaller than usual",
    "Other"
  ]
}
