{
  "schema_version": "1.0.0",
  "mouse_id": "804363",
  "rounds": {
    "R1": "HCR_804363_2026-03-12_13-00-00_processed_2026-07-15_23-36-39",
    "R2": "HCR_804363_2026-03-19_13-00-00_processed_2026-07-15_23-40-05",
    "R3": "HCR_804363_2026-03-26_13-00-00_processed_2026-07-15_23-40-06",
    "R4": "HCR_804363_2026-04-02_13-00-00_processed_2026-07-15_23-42-45",
    "R5": "HCR_804363_2026-04-09_13-00-00_processed_2026-07-15_23-42-45",
    "R6": "HCR_804363_2026-04-16_13-00-00_processed_2026-07-15_23-42-45"
  },
  "mouse_metadata": {
    "species": "mouse",
    "nickname": "Nettle"
  },
  "derived_assets": {
    "roi_classifier_3d": "HCR_804363_2026-03-12_13-00-00_HCR-ROI-label_2026-08-28_18-46-36",
    "spot_parquet": "cell-types-and-learning_spot-parquet_2026-08-28_18-07-44"
  },
  "notes": [
    "Current processing epoch: rounds reprocessed 2026-07-15/17 and re-spot-detected by the 2026-08-27 runs of the aind-hcr-spot-detection pipeline. Derived assets from the previous epoch are under mouse_id 804363-old."
  ]
}
