{
  "schema_version": "1.0.0",
  "mouse_id": "800792",
  "rounds": {
    "R1": "HCR_800792_2026-03-12_13-00-00_processed_2026-07-17_23-08-57",
    "R2": "HCR_800792_2026-03-18_13-00-00_processed_2026-07-15_23-36-04",
    "R3": "HCR_800792_2026-03-25_13-00-00_processed_2026-07-15_23-36-04",
    "R4": "HCR_800792_2026-04-01_13-00-00_processed_2026-07-15_23-36-06",
    "R5": "HCR_800792_2026-04-08_13-00-00_processed_2026-07-15_23-36-06",
    "R6": "HCR_800792_2026-04-15_13-00-00_processed_2026-07-15_23-36-06"
  },
  "mouse_metadata": {
    "species": "mouse",
    "nickname": "Chamomile"
  },
  "notes": [
    "Current processing epoch: rounds reprocessed 2026-07-15/17 and re-spot-detected by the 2026-08-27 runs of the aind-hcr-spot-detection pipeline. Derived assets from the previous epoch are under mouse_id 800792-old.",
    "R1's spot-detection run (computation f03d533f) was still in progress on 2026-08-28; its mixed_spots_R1.pkl had landed but the run had not finished, so no spot_parquet cache has been captured for this mouse yet."
  ]
}
