{
  "schema_version": "1.0.0",
  "mouse_id": "785054-v1",
  "rounds": {
    "R1": "HCR_785054-v1_2025-10-01_13-00-00_processed_2025-10-30_18-13-40",
    "R2": "HCR_785054-v1_2025-10-08_13-00-00_processed_2025-10-29_23-58-27",
    "R3": "HCR_785054-v1_2025-10-15_13-00-00_processed_2025-10-29_23-59-02",
    "R4": "HCR_785054-v1_2025-10-23_13-00-00_processed_2025-10-30_18-20-18",
    "R5": "HCR_785054-v1_2025-10-31_13-00-00_processed_2025-11-03_01-43-41",
    "R6": "HCR_785054-v1_2025-11-06_13-00-00_processed_2025-11-09_21-04-33"
  },
  "mouse_metadata": {
    "species": "mouse",
    "nickname": "Chive"
  },
  "derived_assets": {
    "roi_shape_metrics": "HCR_785054-v1_2025-10-01_13-00-00_roi-shape-metrics"
  }
}
