{
  "schema_version": "1.0.0",
  "mouse_id": "767018",
  "rounds": {
    "R1": "HCR_767018_2025-08-20_14-00-00_processed_2025-09-10_00-33-24",
    "R2": "HCR_767108_2025-08-28_13-00-00_processed_2025-09-10_00-34-49",
    "R3": "HCR_767018_2025-09-05_13-00-00_processed_2025-09-10_00-35-00",
    "R4": "HCR_767018_2025-09-11_13-00-00_processed_2025-09-13_20-42-40",
    "R5": "HCR_767018_2025-09-18_13-00-00_processed_2025-09-20_22-57-09"
  },
  "mouse_metadata": {
    "species": "mouse",
    "nickname": "Oregano"
  },
  "derived_assets": {
    "roi_shape_metrics": "HCR_767018_2025-08-20_14-00-00_roi-shape-metrics",
    "cell_typing": "HCR_767018_cell-typing_2026-03-08_12-00-00",
    "pairwise_unmixing": "HCR_767018_pairwise-unmixing_2026-03-06_12-00-00",
    "czstack_hcr_coreg": "767018_ctl-czstack-hcr-coreg_2025-10-16_00-00-00",
    "roi_classifier_3d": "HCR_767018_2025-08-20_14-00-00_HCR-ROI-label_2026-06-30_21-29-31"
  }
}
