{
  "schema_version": "1.0.0",
  "mouse_id": "788406",
  "rounds": {
    "R1": "HCR_788406_2025-11-05_13-00-00_processed_2025-11-10_20-35-28",
    "R2": "HCR_788406_2025-11-12_15-00-00_processed_2025-11-13_23-00-45",
    "R3": "HCR_788406_2025-11-19_13-00-00_processed_2025-11-21_01-27-21",
    "R4": "HCR_788406_2025-12-03_13-00-00_processed_2025-12-05_22-31-35",
    "R5": "HCR_788406_2025-12-11_13-00-00_processed_2025-12-13_01-51-45"
  },
  "mouse_metadata": {
    "species": "mouse",
    "nickname": "Sage"
  },
  "derived_assets": {
    "roi_shape_metrics": "HCR_788406_2025-11-05_13-00-00_roi-shape-metrics",
    "cell_typing": "HCR_788406_cell-typing_2026-03-11_12-00-00",
    "pairwise_unmixing": "HCR_788406_pairwise-unmixing_2026-07-01_21-56-52",
    "nnls_unmixing": "HCR_788406_nnls-unmixing",
    "czstack_hcr_coreg": "788406_2025-07-18_ctl-czstack-hcr-coreg_2026-03-02_00-00-00",
    "coreg_id_mapping": "multiplane-ophys_788406_2025-05-29_11-29-10_processed_2025-10-06_07-53-22_CTL-coreg-id-mapping_2026-07-08_21-33-12",
    "roi_classifier_3d": "HCR_788406_2025-11-05_13-00-00_HCR-ROI-label_2026-06-30_20-25-30",
    "spot_parquet": "HCR_788406_spot-parquet_2026-08-07_19-20-47"
  }
}
